{
  "pact": "0.3",
  "type": "VerifiableTaskContract",
  "id": "vtc_9f2c11",
  "parties": {
    "buyer": "did:web:buyer.example:agents:procure-1",
    "seller": "did:web:dataforge.example:agents:etl-3",
    "facilitator": "did:web:settle.example",
    "verifier": "did:web:audit.example"
  },
  "task": {
    "spec_hash": "sha256:9491d28ac7a3fcd3f0bf279f78e793547cd4ef111d27ff6bee37f05531823b72",
    "spec_uri": "https://buyer.example/specs/taskspec.json",
    "deadline": "2026-11-14T00:00:00Z"
  },
  "price": {
    "amount": "180.00",
    "currency": "USDC",
    "settlement": "https://settle.example/bindings/ledger-1",
    "network": "eip155:8453"
  },
  "verification": {
    "tier": "T0-reexec",
    "profile": "acceptance",
    "criteria_hash": "sha256:0bdde1ab6b081d2b4bda580c5393756ae95c10b8351c9c55eb9316416265fc1b",
    "max_verdict_seconds": 86400
  },
  "flow": "verdict-first",
  "terms": {
    "profile": "tag:laxsharma79@gmail.com,2026:pact:bonded-restitution",
    "profile_hash": "sha256:c6b85fc09b885fb082e79a2e833356628e77c18a3211f81fc0accf8b07057192",
    "parameters": {
      "seller_bond": "18.00",
      "verification_fund": "0.50",
      "cap": "180.00",
      "restitution_basis": "released",
      "remainder_to": "sink",
      "principal_on": "verdict",
      "assurance": {
        "mode": "certain",
        "q_min": 1.0
      }
    }
  },
  "challenge": {
    "window_seconds": 3600,
    "max_dispute_seconds": 86400
  },
  "signatures": [
    {
      "protected": "eyJhbGciOiJFZDI1NTE5Iiwia2lkIjoiZGlkOndlYjpidXllci5leGFtcGxlOmFnZW50czpwcm9jdXJlLTEjazEiLCJ0eXAiOiJhcHBsaWNhdGlvbi92bmQucGFjdC5jb250cmFjdCtqc29uIn0",
      "signature": "fhjNTI58u9d7rz_UGzMwX4OgnTZpaIuCvpGslAxJXBE25LdMIIvhERtsbebaZ3N1bpcX6Gxm6-s_VLrn4jZiAQ"
    },
    {
      "protected": "eyJhbGciOiJFZDI1NTE5Iiwia2lkIjoiZGlkOndlYjpkYXRhZm9yZ2UuZXhhbXBsZTphZ2VudHM6ZXRsLTMjazEiLCJ0eXAiOiJhcHBsaWNhdGlvbi92bmQucGFjdC5jb250cmFjdCtqc29uIn0",
      "signature": "c5mxJ6yR7TRJRtnSW1teUaEKLADBc0MmuqiAKpksUzqkrElxtZWL6qX5fe-j17SVTWrVxjDSJPYC05aunNCJBw"
    }
  ]
}
